{"schemaVersion":"1.0.0","projectId":"R03","cycle":{"cycleId":"R03-C1","currentRevision":1,"status":"CURRENT"},"facts":[{"id":"F1","claim":"교육용 매출은 910만원","value":910,"unit":"만원","evidenceRefs":["E1"]}],"evidence":[{"id":"E1","source":"fixture-ledger","locator":"R03:1"}],"requirements":[{"id":"Q1","text":"근거를 표시한다","sourceRef":"E1","status":"REQUIRED"}],"decisions":[{"id":"D1","value":"SECTION HWPX","approvedBy":"fixture-owner"}],"businessVerdicts":[{"id":"V1","status":"PASS","reason":"가상 근거 확인","evidenceRefs":["E1"]}],"contentSteps":[{"id":"official-requirements","status":"PASS","evidenceRefs":["E1"]},{"id":"business-facts","status":"PASS","evidenceRefs":["E1"]},{"id":"evidence-research","status":"PASS","evidenceRefs":["E1"]},{"id":"selected-section-draft","status":"PASS","evidenceRefs":["E1"]},{"id":"selected-section-review","status":"PASS","evidenceRefs":["E1"]},{"id":"content-approval","status":"PASS","evidenceRefs":["E1"]}],"scope":"SECTION","sectionId":"market","outputs":{"hwpx":true,"ppt":false},"rendererMode":null}
