{"schemaVersion":"1.0.0","projectId":"R08","cycle":{"cycleId":"R08-C1","currentRevision":1,"status":"CURRENT"},"facts":[{"id":"F1","claim":"교육용 매출은 910만원","value":910,"unit":"만원","evidenceRefs":["E1"]}],"evidence":[{"id":"E1","source":"fixture-ledger","locator":"R08:1"}],"requirements":[{"id":"Q1","text":"근거를 표시한다","sourceRef":"E1","status":"REQUIRED"}],"decisions":[{"id":"D1","value":"FULL BOTH","approvedBy":"fixture-owner"}],"businessVerdicts":[{"id":"V1","status":"PASS","reason":"가상 근거 확인","evidenceRefs":["E1"]}],"contentSteps":[{"id":"setup-business-plan-project","status":"PASS","evidenceRefs":["E1"]},{"id":"analyze-official-requirements","status":"PASS","evidenceRefs":["E1"]},{"id":"diagnose-business-gaps","status":"PASS","evidenceRefs":["E1"]},{"id":"research-business-evidence","status":"PASS","evidenceRefs":["E1"]},{"id":"design-business-strategy","status":"PASS","evidenceRefs":["E1"]},{"id":"draft-business-plan","status":"PASS","evidenceRefs":["E1"]},{"id":"review-business-plan","status":"PASS","evidenceRefs":["E1"]}],"scope":"FULL","outputs":{"hwpx":true,"ppt":true},"rendererMode":"scene-deck"}
