{"schemaVersion":"1.0.0","projectId":"R01","cycle":{"cycleId":"R01-C1","currentRevision":1,"status":"CURRENT"},"facts":[{"id":"F1","claim":"교육용 매출은 910만원","value":910,"unit":"만원","evidenceRefs":["E1"]}],"evidence":[{"id":"E1","source":"fixture-ledger","locator":"R01:1"}],"requirements":[{"id":"Q1","text":"근거를 표시한다","sourceRef":"E1","status":"REQUIRED"}],"decisions":[{"id":"D1","value":"QUICK","approvedBy":"fixture-owner"}],"businessVerdicts":[{"id":"V1","status":"PASS","reason":"가상 근거 확인","evidenceRefs":["E1"]}],"contentSteps":[{"id":"gap-diagnosis","status":"PASS","evidenceRefs":["E1"]},{"id":"evidence-record","status":"PASS","evidenceRefs":["E1"]},{"id":"change-record","status":"PASS","evidenceRefs":["E1"]},{"id":"action-card","status":"PASS","evidenceRefs":["E1"]}],"scope":"QUICK","outputs":{"hwpx":false,"ppt":false},"rendererMode":null}
